Lang;FR;EN;NL;ES;EP
Dial;Bienvenue à Nordilsburg. Ne troublez pas l’ordre publique.;;;;
Dial;Je suis le dernier à connaître le Nordilsburgeois.;;;;
Dial;À ma mort j’emporterai notre glorieuse langue dans ma tombe;;;;
Dial;Depuis que la Capitale à instauré l’Espérance comme langue commune il y a 100 ans, nous avons perdu une partie de notre identité.;;;;
Dial;Mon grand-père est cartographe. Il est partit au sommet de la montagne pour mieux cartographier le monde.;;;;
Dial;Ça fait des jours qu’il n’est pas revenu. Mon papy… est-ce qu’il est mort ?;;;;
Dial;;;;;
Dial;;;;;
Dial;;;;;
